{
 "subject": "religious-studies",
 "board": "AQA",
 "topic": "RS24-zakah-and-khums",
 "topicName": "Zakah and Khums",
 "version": 1,
 "cards": [
  {
   "id": "rs24-zakah-and-khums-fc1",
   "front": "Recall a key point about Zakah and Khums",
   "back": "Zakah is the third Pillar of Islam — Muslims must give 2.5% of their surplus wealth each year to charity. It is not optional; it is a religious duty and a form of worship. Shi'a Muslims also pay khums (20% of surplus income) to their religious leaders.",
   "tags": [
    "key-fact"
   ],
   "difficulty": 2,
   "ao": "AO1"
  },
  {
   "id": "rs24-zakah-and-khums-fc2",
   "front": "What should you know about rs exam tips — zakah and khums?",
   "back": "1. For Zakah and Khums questions, always include specific scriptural or source references where relevant 2. Explain both religious and non-religious viewpoints 3. Use specialist vocabulary precisely (e.g. terms from the specification) 4. Evaluate by analysing strengths and weaknesses of different views before reaching your conclusion 5. Link your discussion of Zakah and Khums to its real-world impact on believers and society",
   "tags": [
    "rs-exam-tips-zakah-and-khums"
   ],
   "difficulty": 2,
   "ao": "AO1"
  },
  {
   "id": "rs24-zakah-and-khums-fc3",
   "front": "What should you know about uk context?",
   "back": "If a British Muslim has savings of £20,000 held for a full year above the nisab threshold, they would pay £500 in zakah (2.5% of £20,000). Islamic Relief UK and the National Zakat Foundation provide online zakah calculators to help British Muslims calculate their obligation accurately.",
   "tags": [
    "uk-context"
   ],
   "difficulty": 2,
   "ao": "AO1"
  },
  {
   "id": "rs24-zakah-and-khums-fc4",
   "front": "What should you know about uk context?",
   "back": "In the UK, Shi’a mosques and centres such as the Al-Khoei Foundation in London and the Imam Ali Foundation collect and distribute khums according to the guidance of their marja. These funds support religious schools, community programmes and charitable work both in Britain and internationally.",
   "tags": [
    "uk-context"
   ],
   "difficulty": 2,
   "ao": "AO1"
  },
  {
   "id": "rs24-zakah-and-khums-fc5",
   "front": "What should you know about uk context?",
   "back": "During the COVID-19 pandemic, British Muslim charities mobilised rapidly to support the wider community. The National Zakat Foundation distributed emergency food parcels, Islamic Relief UK provided grants to families affected by job losses, and mosques across the country offered their premises as vaccination centres — demonstrating how Islamic charitable principles extend beyond the Muslim community.",
   "tags": [
    "uk-context"
   ],
   "difficulty": 2,
   "ao": "AO1"
  },
  {
   "id": "rs24-zakah-and-khums-fc6",
   "front": "Watch Out!",
   "back": "Students often think jihad means \"holy war.\" Wrong: \"Jihad means holy war.\" Correct: \"Jihad means \"struggle\" or \"striving.\" Greater jihad is the internal spiritual struggle to live as a good Muslim. Lesser jihad is armed struggle, which has strict conditions and is a last resort.\"",
   "tags": [
    "section"
   ],
   "difficulty": 3,
   "ao": "AO1"
  },
  {
   "id": "rs24-zakah-and-khums-fc7",
   "front": "Full-Mark Response",
   "back": "12 marks: Evaluate the view that the role and significance of giving alms; how and why it is given; khums in shi'a islam.",
   "tags": [
    "section"
   ],
   "difficulty": 3,
   "ao": "AO1"
  },
  {
   "id": "rs24-zakah-and-khums-fc8",
   "front": "Assessment Objective Focus: Zakah and Khums",
   "back": "AO1 — Knowledge: Show precise knowledge of Zakah and Khums, using specialist vocabulary and referring to sources of wisdom and authority (e.g. scripture, sacred texts).",
   "tags": [
    "section"
   ],
   "difficulty": 3,
   "ao": "AO1"
  },
  {
   "id": "rs24-zakah-and-khums-fc9",
   "front": "Ready to ace your GCSE Religious Studies exams?",
   "back": "Get the best revision books and guides to boost your grades.",
   "tags": [
    "section"
   ],
   "difficulty": 3,
   "ao": "AO1"
  }
 ]
}