{
 "subject": "chemistry",
 "board": "AQA",
 "topic": "C17-rate-of-reaction",
 "topicName": "Rate Of Reaction",
 "version": 1,
 "cards": [
  {
   "id": "c17-rate-of-reaction-fc1",
   "front": "What should you know about rate of reaction?",
   "back": "How fast a chemical reaction takes place. It measures how quickly reactants are used up or how quickly products are formed.",
   "tags": [
    "rate-of-reaction"
   ],
   "difficulty": 2,
   "ao": "AO1"
  },
  {
   "id": "c17-rate-of-reaction-fc2",
   "front": "What should you know about collision theory?",
   "back": "Chemical reactions can only happen when reactant particles collide with each other with enough energy. The minimum energy needed for a reaction is called the activation energy.",
   "tags": [
    "collision-theory"
   ],
   "difficulty": 2,
   "ao": "AO1"
  },
  {
   "id": "c17-rate-of-reaction-fc3",
   "front": "What should you know about activation energy?",
   "back": "The minimum amount of energy that colliding particles must have for a reaction to occur. Not all collisions lead to a reaction — only successful collisions with enough energy.",
   "tags": [
    "activation-energy"
   ],
   "difficulty": 2,
   "ao": "AO1"
  },
  {
   "id": "c17-rate-of-reaction-fc4",
   "front": "What should you know about catalyst?",
   "back": "A substance that speeds up a chemical reaction without being used up. It works by lowering the activation energy, providing an alternative reaction pathway.",
   "tags": [
    "catalyst"
   ],
   "difficulty": 2,
   "ao": "AO1"
  },
  {
   "id": "c17-rate-of-reaction-fc5",
   "front": "What should you know about important distinction?",
   "back": "Increasing temperature increases both the frequency of collisions AND the energy of each collision. Increasing concentration or surface area only increases the frequency of collisions — the energy of each collision stays the same.",
   "tags": [
    "important-distinction"
   ],
   "difficulty": 2,
   "ao": "AO1"
  },
  {
   "id": "c17-rate-of-reaction-fc6",
   "front": "What should you know about reading rate graphs?",
   "back": "The steeper the gradient, the faster the reaction The gradient is steepest at the start (fastest rate) and becomes shallower as the reaction slows down The graph levels off (plateau) when the reaction is complete — one reactant has been used up To calculate the rate at a specific time, draw a tangent to the curve at that point and find its gradient",
   "tags": [
    "reading-rate-graphs"
   ],
   "difficulty": 2,
   "ao": "AO1"
  },
  {
   "id": "c17-rate-of-reaction-fc7",
   "front": "Recall a key point about Rate Of Reaction",
   "back": "You need to calculate rates from data (rate = amount ÷ time or rate = 1/time), calculate gradients of rate graphs, and interpret data from required practical experiments.",
   "tags": [],
   "difficulty": 2,
   "ao": "AO1"
  },
  {
   "id": "c17-rate-of-reaction-fc8",
   "front": "What should you know about answers?",
   "back": "(a) Large lumps rate = 50 ÷ 300 = 0.167 cm³/s. Fine powder rate = 100 ÷ 50 = 2.0 cm³/s. (b) The powder has a much larger surface area than the lumps. More CaCO₃ particles are exposed and available to collide with HCl particles. This means more frequent collisions and more successful collisions per second, so the rate is much faster. (c) Both experiments produced the same total volume (100 cm³) of CO₂. Surface area affects the RATE of reaction but NOT the total amount of product — this is determined by the amount of limiting reactant.",
   "tags": [
    "answers"
   ],
   "difficulty": 2,
   "ao": "AO1"
  },
  {
   "id": "c17-rate-of-reaction-fc9",
   "front": "Required Practical: Effect of Concentration on Rate",
   "back": "Aim: Investigate how the concentration of hydrochloric acid affects the rate of reaction with sodium thiosulfate.",
   "tags": [
    "section"
   ],
   "difficulty": 3,
   "ao": "AO1"
  },
  {
   "id": "c17-rate-of-reaction-fc10",
   "front": "Watch Out!",
   "back": "1. Wrong: Increasing concentration increases the energy of collisions Correct: Increasing concentration only increases the FREQUENCY of collisions — particles do not gain more kinetic energy. Only increasing temperature increases collision energy",
   "tags": [
    "section"
   ],
   "difficulty": 3,
   "ao": "AO1"
  },
  {
   "id": "c17-rate-of-reaction-fc11",
   "front": "Extended Answer",
   "back": "6 marks: Explain, using collision theory, why increasing the temperature increases the rate of a chemical reaction. Include ideas about both collision frequency and collision energy.",
   "tags": [
    "section"
   ],
   "difficulty": 3,
   "ao": "AO1"
  },
  {
   "id": "c17-rate-of-reaction-fc12",
   "front": "Analysis and Evaluation",
   "back": "A student investigated the effect of surface area on the rate of reaction between calcium carbonate and hydrochloric acid. They used the same mass (2.0 g) of CaCO₃ in two forms: large lumps and fine powder. The volume of CO₂ produced was measured over time.",
   "tags": [
    "section"
   ],
   "difficulty": 3,
   "ao": "AO1"
  },
  {
   "id": "c17-rate-of-reaction-fc13",
   "front": "Ready to ace your GCSE Combined Science exams?",
   "back": "Get the best revision books and guides to boost your grades.",
   "tags": [
    "section"
   ],
   "difficulty": 3,
   "ao": "AO1"
  }
 ]
}