{
 "subject": "food-preparation-nutrition",
 "board": "AQA",
 "topic": "FN1-macronutrients",
 "topicName": "Macronutrients",
 "version": 1,
 "cards": [
  {
   "id": "fn1-macronutrients-fc1",
   "front": "Recall a key point about Macronutrients",
   "back": "Carbohydrates are the body's main source of energy. They are divided into sugars (simple, quick-release) and starches (complex, slow-release). Excess glucose is stored as glycogen in the liver and muscles, or converted to fat.",
   "tags": [
    "key-fact"
   ],
   "difficulty": 2,
   "ao": "AO1"
  },
  {
   "id": "fn1-macronutrients-fc2",
   "front": "Recall a key point about Macronutrients",
   "back": "Proteins are essential for growth, repair, and maintenance of body tissues. They are made up of amino acids — there are 20 amino acids, 9 of which are essential (cannot be synthesised by the body and must come from food).",
   "tags": [
    "key-fact"
   ],
   "difficulty": 2,
   "ao": "AO1"
  },
  {
   "id": "fn1-macronutrients-fc3",
   "front": "Recall a key point about Macronutrients",
   "back": "High biological value (HBV) proteins contain all 9 essential amino acids — found in animal sources (meat, fish, eggs, dairy) and soya. Low biological value (LBV) proteins lack one or more essential amino acids — found in plant sources (cereals, pulses, nuts).",
   "tags": [
    "key-fact"
   ],
   "difficulty": 2,
   "ao": "AO1"
  },
  {
   "id": "fn1-macronutrients-fc4",
   "front": "Recall a key point about Macronutrients",
   "back": "Complementary proteins: combining LBV protein sources to provide all essential amino acids — e.g. rice and beans, hummus and pitta, toast and baked beans.",
   "tags": [
    "key-fact"
   ],
   "difficulty": 2,
   "ao": "AO1"
  },
  {
   "id": "fn1-macronutrients-fc5",
   "front": "Recall a key point about Macronutrients",
   "back": "Fats (lipids) provide concentrated energy (9 kcal/g vs 4 kcal/g for carbs and protein), insulate the body, protect organs, carry fat-soluble vitamins (A, D, E, K), and provide essential fatty acids.",
   "tags": [
    "key-fact"
   ],
   "difficulty": 2,
   "ao": "AO1"
  },
  {
   "id": "fn1-macronutrients-fc6",
   "front": "Recall a key point about Macronutrients",
   "back": "Saturated fats (mainly animal sources — butter, lard, cheese) are solid at room temperature and raise LDL cholesterol. Unsaturated fats (plant and fish sources — olive oil, oily fish) are liquid and can help lower cholesterol.",
   "tags": [
    "key-fact"
   ],
   "difficulty": 2,
   "ao": "AO1"
  },
  {
   "id": "fn1-macronutrients-fc7",
   "front": "Recall a key point about Macronutrients",
   "back": "Trans fats are artificially hydrogenated fats found in processed foods; they raise LDL cholesterol and lower HDL cholesterol, increasing heart disease risk.",
   "tags": [
    "key-fact"
   ],
   "difficulty": 2,
   "ao": "AO1"
  },
  {
   "id": "fn1-macronutrients-fc8",
   "front": "Recall a key point about Macronutrients",
   "back": "The Eatwell Guide recommends: carbohydrates should provide about 50% of energy, fats about 35%, and protein about 15%. Most people in the UK eat too much saturated fat and sugar, and not enough fibre.",
   "tags": [
    "key-fact"
   ],
   "difficulty": 2,
   "ao": "AO1"
  },
  {
   "id": "fn1-macronutrients-fc9",
   "front": "Recall a key point about Macronutrients",
   "back": "NSP (non-starch polysaccharides) / dietary fibre is not digested but is essential for bowel health, preventing constipation, and reducing risk of bowel cancer. Recommended: 30g/day for adults.",
   "tags": [
    "key-fact"
   ],
   "difficulty": 2,
   "ao": "AO1"
  },
  {
   "id": "fn1-macronutrients-fc10",
   "front": "Recall a key point about Macronutrients",
   "back": "Energy balance: energy in (calories consumed) vs energy out (BMR + physical activity). Positive energy balance = weight gain; negative = weight loss; neutral = weight maintenance.",
   "tags": [
    "key-fact"
   ],
   "difficulty": 2,
   "ao": "AO1"
  },
  {
   "id": "fn1-macronutrients-fc11",
   "front": "Recall a key point about Macronutrients",
   "back": "Deficiency diseases: kwashiorkor (protein deficiency — swollen belly, poor growth), marasmus (severe calorie deficiency — extreme thinness), scurvy (vitamin C deficiency — bleeding gums).",
   "tags": [
    "key-fact"
   ],
   "difficulty": 2,
   "ao": "AO1"
  },
  {
   "id": "fn1-macronutrients-fc12",
   "front": "Recall a key point about Macronutrients",
   "back": "Current UK dietary concerns: excess sugar, saturated fat, and salt intake; insufficient fibre, fruit, vegetables, and oily fish. These contribute to obesity, type 2 diabetes, heart disease, and certain cancers.",
   "tags": [
    "key-fact"
   ],
   "difficulty": 2,
   "ao": "AO1"
  },
  {
   "id": "fn1-macronutrients-fc13",
   "front": "What should you know about food preparation & nutrition exam tips — macronutrients?",
   "back": "1. For Macronutrients questions, show every step of your working clearly — method marks count even if the final answer is wrong 2. Check your answer makes sense in context (estimation, units, reasonableness) 3. Use correct mathematical notation and state formulae before substituting values 4. If a Macronutrients question asks you to 'prove' or 'show', write a logical chain of reasoning with a conclusion line 5. For problem-solving, identify the topic first, then recall the relevant method",
   "tags": [
    "food-preparation-nutrition-exa"
   ],
   "difficulty": 2,
   "ao": "AO1"
  },
  {
   "id": "fn1-macronutrients-fc14",
   "front": "Full-Mark Response",
   "back": "Evaluate the role of macronutrients in maintaining a healthy diet. [12 marks]",
   "tags": [
    "section"
   ],
   "difficulty": 3,
   "ao": "AO1"
  },
  {
   "id": "fn1-macronutrients-fc15",
   "front": "Assessment Objective Analysis",
   "back": "AO1 (Knowledge & Understanding): Demonstrate knowledge and understanding of macronutrients, including nutritional principles, food science, and food safety regulations. AO2 (Application): Apply knowledge and understanding of macronutrients to practical cooking contexts, recipe adaptation, and food choice decisions. AO3 (Analysis & Evaluation): Analyse and evaluate macronutrients in relation to nut",
   "tags": [
    "section"
   ],
   "difficulty": 3,
   "ao": "AO1"
  }
 ]
}