{
 "subject": "sociology",
 "board": "AQA",
 "topic": "SO10-educational-achievement",
 "topicName": "Educational Achievement & Inequality",
 "version": 1,
 "cards": [
  {
   "id": "so10-educational-achievement-fc1",
   "front": "Recall a key point about Educational Achievement & Inequality",
   "back": "Social class and achievement: working-class students consistently achieve less well than middle-class students. External factors: material deprivation (poorer housing, less study space, no internet), cultural deprivation (Bernstein: restricted code vs elaborated code), cultural capital (Bourdieu: middle-class knowledge, tastes and values give advantage in school). Internal factors: streaming and labelling (Becker: teachers have an 'ideal pupil' image that is middle-class).",
   "tags": [
    "key-fact"
   ],
   "difficulty": 2,
   "ao": "AO1"
  },
  {
   "id": "so10-educational-achievement-fc2",
   "front": "Recall a key point about Educational Achievement & Inequality",
   "back": "Gender and achievement: girls now outperform boys at every level (61% of girls vs 50% of boys achieve 5+ GCSEs A*-C). Reasons for girls' improvement: feminism (changed aspirations), changing family patterns (more women-headed households), employment opportunities (more jobs for women), GCSE coursework favoured girls. Reasons for boys' underachievement: laddish subcultures (Epstein: working-class boys see academic work as 'unmasculine'), male role model deficit (few male primary teachers).",
   "tags": [
    "key-fact"
   ],
   "difficulty": 2,
   "ao": "AO1"
  },
  {
   "id": "so10-educational-achievement-fc3",
   "front": "Recall a key point about Educational Achievement & Inequality",
   "back": "Ethnicity and achievement: Chinese and Indian students achieve above the national average; Bangladeshi, Pakistani and Black Caribbean students achieve below. External factors: language barriers (English as additional language), material deprivation (higher poverty rates among some ethnic groups), family structure (more lone-parent families among Black Caribbean). Internal factors: teacher labelling (Gillborn and Youdell: teachers have lower expectations of Black students), institutional racism (policies that inadvertently disadvantage ethnic minorities), ethnocentric curriculum.",
   "tags": [
    "key-fact"
   ],
   "difficulty": 2,
   "ao": "AO1"
  },
  {
   "id": "so10-educational-achievement-fc4",
   "front": "Recall a key point about Educational Achievement & Inequality",
   "back": "Labelling and self-fulfilling prophecy: Rosenthal and Jacobson's Pygmalion study showed that teacher expectations influenced student performance. Students labelled as 'bright' improved; those labelled as 'slow' declined. Becker: teachers judge students against the 'ideal pupil' (middle-class, compliant, motivated).",
   "tags": [
    "key-fact"
   ],
   "difficulty": 2,
   "ao": "AO1"
  },
  {
   "id": "so10-educational-achievement-fc5",
   "front": "Recall a key point about Educational Achievement & Inequality",
   "back": "Streaming and setting: students are placed in ability groups. Hargreaves: streaming creates anti-school subcultures in lower streams (students reject school values because the school has rejected them). Gillborn and Youdell: the 'educational triage' - schools categorise students as those who will pass anyway, those with potential to improve, and hopeless cases - working-class and Black students are disproportionately placed in the 'hopeless' category.",
   "tags": [
    "key-fact"
   ],
   "difficulty": 2,
   "ao": "AO1"
  },
  {
   "id": "so10-educational-achievement-fc6",
   "front": "What should you know about sociology exam tips?",
   "back": "When discussing educational inequality, always: distinguish external from internal factors, use named studies (Bourdieu, Bernstein, Becker, Gillborn), and evaluate which factors are most important for each group (class, gender, ethnicity).",
   "tags": [
    "sociology-exam-tips"
   ],
   "difficulty": 2,
   "ao": "AO1"
  },
  {
   "id": "so10-educational-achievement-fc7",
   "front": "Watch Out!",
   "back": "Students often make mistakes here. Wrong: Differences in educational achievement are due to natural differences in intelligence between social groups. Correct: Sociological research consistently shows that achievement differences are caused by social factors, not innate intelligence: cultural capital gives middle-class children advantages; labelling and streaming disadvantage working-class and eth",
   "tags": [
    "section"
   ],
   "difficulty": 3,
   "ao": "AO1"
  },
  {
   "id": "so10-educational-achievement-fc8",
   "front": "Full-Mark Response",
   "back": "Evaluate the relative importance of internal and external factors in explaining social class differences in educational achievement.",
   "tags": [
    "section"
   ],
   "difficulty": 3,
   "ao": "AO1"
  },
  {
   "id": "so10-educational-achievement-fc9",
   "front": "Assessment Objective Focus: Educational Achievement & Inequality",
   "back": "AO1 — Knowledge: Show knowledge of Educational Achievement & Inequality using sociological terminology accurately. Identify key thinkers, concepts and theoretical perspectives.",
   "tags": [
    "section"
   ],
   "difficulty": 3,
   "ao": "AO1"
  },
  {
   "id": "so10-educational-achievement-fc10",
   "front": "Ready to ace your GCSE Sociology exams?",
   "back": "Get the best revision books and guides to boost your grades.",
   "tags": [
    "section"
   ],
   "difficulty": 3,
   "ao": "AO1"
  }
 ]
}