{
 "subject": "art-and-design",
 "board": "AQA",
 "topic": "GC5-packaging-and-print-design",
 "topicName": "Packaging and Print Design",
 "version": 1,
 "cards": [
  {
   "id": "gc5-packaging-and-print-design-fc1",
   "front": "Recall a key point about Packaging and Print Design",
   "back": "Packaging nets are 2D templates that fold into 3D containers — understanding tabs, glue flaps and die-cuts is essential.",
   "tags": [
    "key-fact"
   ],
   "difficulty": 2,
   "ao": "AO1"
  },
  {
   "id": "gc5-packaging-and-print-design-fc2",
   "front": "Recall a key point about Packaging and Print Design",
   "back": "Sustainable packaging considers material choice, minimal waste, recyclability and environmental impact.",
   "tags": [
    "key-fact"
   ],
   "difficulty": 2,
   "ao": "AO1"
  },
  {
   "id": "gc5-packaging-and-print-design-fc3",
   "front": "Recall a key point about Packaging and Print Design",
   "back": "Print processes differ: offset litho for high-volume, digital for short runs and variable data, screen for speciality finishes.",
   "tags": [
    "key-fact"
   ],
   "difficulty": 2,
   "ao": "AO1"
  },
  {
   "id": "gc5-packaging-and-print-design-fc4",
   "front": "Recall a key point about Packaging and Print Design",
   "back": "Information graphics use visual design to communicate data clearly — charts, diagrams, maps and infographics.",
   "tags": [
    "key-fact"
   ],
   "difficulty": 2,
   "ao": "AO1"
  },
  {
   "id": "gc5-packaging-and-print-design-fc5",
   "front": "What should you know about graphic communication exam tips?",
   "back": "Show the FLAT NET and the ASSEMBLED package. Test that your net actually folds — make a prototype. Consider sustainability — annotate material choices. Include all required information (barcode, contents, warnings).",
   "tags": [
    "graphic-communication-exam-tip"
   ],
   "difficulty": 2,
   "ao": "AO1"
  },
  {
   "id": "gc5-packaging-and-print-design-fc6",
   "front": "What does Lithography mean?",
   "back": "High-volume packaging, magazines (e.g. High (plates))",
   "tags": [
    "table"
   ],
   "difficulty": 2,
   "ao": "AO1"
  },
  {
   "id": "gc5-packaging-and-print-design-fc7",
   "front": "What does Digital mean?",
   "back": "Short runs, personalisation (e.g. Low)",
   "tags": [
    "table"
   ],
   "difficulty": 2,
   "ao": "AO1"
  },
  {
   "id": "gc5-packaging-and-print-design-fc8",
   "front": "What does Screen mean?",
   "back": "Textiles, posters, thick inks (e.g. Medium)",
   "tags": [
    "table"
   ],
   "difficulty": 2,
   "ao": "AO1"
  },
  {
   "id": "gc5-packaging-and-print-design-fc9",
   "front": "What does Flexography mean?",
   "back": "Flexible packaging, labels (e.g. Medium)",
   "tags": [
    "table"
   ],
   "difficulty": 2,
   "ao": "AO1"
  },
  {
   "id": "gc5-packaging-and-print-design-fc10",
   "front": "What does Foil blocking mean?",
   "back": "Premium finishes on packaging (e.g. Medium (die))",
   "tags": [
    "table"
   ],
   "difficulty": 2,
   "ao": "AO1"
  },
  {
   "id": "gc5-packaging-and-print-design-fc11",
   "front": "Watch Out!",
   "back": "Students often make mistakes with this topic. Wrong: Packaging design is just about making the box look attractive. Correct: Packaging design must consider: PROTECTION (does it keep the product safe?), FUNCTION (does it open/close properly?), SUSTAINABILITY (materials, waste, recyclability), LEGISLATION (barcodes, ingredients, safety warnings), and aesthetics.",
   "tags": [
    "section"
   ],
   "difficulty": 3,
   "ao": "AO1"
  },
  {
   "id": "gc5-packaging-and-print-design-fc12",
   "front": "Full-Mark Response",
   "back": "Design packaging for a product. Create the net, consider materials and sustainability, and design the surface graphics. Build a prototype and annotate your design decisions.",
   "tags": [
    "section"
   ],
   "difficulty": 3,
   "ao": "AO1"
  },
  {
   "id": "gc5-packaging-and-print-design-fc13",
   "front": "Assessment Objective Focus: Packaging and Print Design",
   "back": "AO1 — Knowledge: Demonstrate knowledge of Packaging and Print Design using appropriate art vocabulary. Identify techniques, materials and processes accurately.",
   "tags": [
    "section"
   ],
   "difficulty": 3,
   "ao": "AO1"
  },
  {
   "id": "gc5-packaging-and-print-design-fc14",
   "front": "Functions of Packaging",
   "back": "Packaging serves four key functions: Protection (keeping the product safe during transport and storage), Containment (holding the product securely), Information (displaying legal requirements, ingredients, barcodes, and instructions), and Promotion (attracting customers at point of sale). Good packaging balances all four — a beautiful box that fails to protect the product is useless, and strong pr",
   "tags": [
    "section"
   ],
   "difficulty": 3,
   "ao": "AO1"
  },
  {
   "id": "gc5-packaging-and-print-design-fc15",
   "front": "Print Processes and Finishes",
   "back": "Lithography (litho) prints high-quality, consistent colour in large quantities — ideal for magazines and packaging. Digital printing is cost-effective for short runs and personalisation. Screen printing suits thick inks on textiles and posters. Foil blocking applies metallic foil using heat and pressure for premium finishes. Embossing/debossing creates raised or recessed designs. Spot UV varnish h",
   "tags": [
    "section"
   ],
   "difficulty": 3,
   "ao": "AO1"
  }
 ]
}