{
 "subject": "biology",
 "board": "AQA",
 "topic": "B8-health-and-disease",
 "topicName": "B8 Health And Disease",
 "version": 1,
 "cards": [
  {
   "id": "b8-health-and-disease-fc1",
   "front": "What should you know about health?",
   "back": "is a state of physical and mental wellbeing, not just the absence of disease. Diseases can be communicable (can be passed between individuals) or non-communicable (cannot be passed on). Risk factors increase the likelihood of developing a non-communicable disease.",
   "tags": [
    "health"
   ],
   "difficulty": 2,
   "ao": "AO1"
  },
  {
   "id": "b8-health-and-disease-fc2",
   "front": "What should you know about health?",
   "back": "is defined by the WHO as \"a state of complete physical, mental and social wellbeing and not merely the absence of disease or infirmity.\" This means health is about more than just not being ill - it includes mental health, social wellbeing and physical fitness.",
   "tags": [
    "health"
   ],
   "difficulty": 2,
   "ao": "AO1"
  },
  {
   "id": "b8-health-and-disease-fc3",
   "front": "What should you know about physical and mental health are linked.?",
   "back": "A person with a long-term physical illness is more likely to suffer from depression. A person with a mental health condition may neglect their physical health, leading to further problems.",
   "tags": [
    "physical-and-mental-health-are"
   ],
   "difficulty": 2,
   "ao": "AO1"
  },
  {
   "id": "b8-health-and-disease-fc4",
   "front": "What should you know about communicable diseases?",
   "back": "can be passed from person to person (they are infectious, caused by pathogens such as bacteria, viruses, fungi and protists). Non-communicable diseases cannot be passed between people - they develop over time and are often linked to lifestyle or genetic factors.",
   "tags": [
    "communicable-diseases"
   ],
   "difficulty": 2,
   "ao": "AO1"
  },
  {
   "id": "b8-health-and-disease-fc5",
   "front": "What should you know about non-communicable diseases?",
   "back": "are the leading cause of death globally. They develop over a long time and are often caused by a combination of genetic and lifestyle factors. The three main non-communicable diseases at GCSE level are cancer, cardiovascular disease and diabetes.",
   "tags": [
    "non-communicable-diseases"
   ],
   "difficulty": 2,
   "ao": "AO1"
  },
  {
   "id": "b8-health-and-disease-fc6",
   "front": "What should you know about a risk factor?",
   "back": "is something that increases the chance of developing a disease. Having a risk factor does NOT mean you will definitely get the disease - it only increases the probability. Some risk factors are lifestyle choices; others are beyond our control.",
   "tags": [
    "a-risk-factor"
   ],
   "difficulty": 2,
   "ao": "AO1"
  },
  {
   "id": "b8-health-and-disease-fc7",
   "front": "What should you know about some risk factors are not lifestyle choices?",
   "back": "Age, gender, genetics and family history can all be risk factors that you cannot change. For example, a family history of breast cancer increases your risk regardless of lifestyle.",
   "tags": [
    "some-risk-factors-are-not-life"
   ],
   "difficulty": 2,
   "ao": "AO1"
  },
  {
   "id": "b8-health-and-disease-fc8",
   "front": "What should you know about correlation?",
   "back": "means two things are linked statistically - when one goes up, the other goes up (or down). Causation means one thing directly causes the other. A correlation does NOT prove causation.",
   "tags": [
    "correlation"
   ],
   "difficulty": 2,
   "ao": "AO1"
  },
  {
   "id": "b8-health-and-disease-fc9",
   "front": "What should you know about cancer?",
   "back": "is caused by uncontrolled cell division. When cells divide uncontrollably, they form a mass of abnormal cells called a tumour . Tumours can be benign (not cancer) or malignant (cancer).",
   "tags": [
    "cancer"
   ],
   "difficulty": 2,
   "ao": "AO1"
  },
  {
   "id": "b8-health-and-disease-fc10",
   "front": "What should you know about metastasis?",
   "back": "Malignant tumour cells can break off from the original tumour and travel through the bloodstream or lymphatic system to other parts of the body. There, they form new (secondary) tumours. This is why malignant tumours are so dangerous - they can affect multiple organs.",
   "tags": [
    "metastasis"
   ],
   "difficulty": 2,
   "ao": "AO1"
  },
  {
   "id": "b8-health-and-disease-fc11",
   "front": "What should you know about diseases can interact with each other.?",
   "back": "Having one disease can make a person more susceptible to another. The immune system, mental health and physical damage caused by one disease can all affect the risk of developing other conditions.",
   "tags": [
    "diseases-can-interact-with-eac"
   ],
   "difficulty": 2,
   "ao": "AO1"
  },
  {
   "id": "b8-health-and-disease-fc12",
   "front": "What should you know about lifestyle choices?",
   "back": "have a major impact on the risk of developing non-communicable diseases. Making healthy choices can significantly reduce the risk, while unhealthy choices increase it. However, even healthy people can develop diseases due to genetic or other factors.",
   "tags": [
    "lifestyle-choices"
   ],
   "difficulty": 2,
   "ao": "AO1"
  },
  {
   "id": "b8-health-and-disease-fc13",
   "front": "Recall a key point about B8 Health And Disease",
   "back": "Lifestyle changes reduce risk but cannot eliminate it entirely. Genetic factors and age also play a role. Someone with a very healthy lifestyle can still develop cancer or heart disease.",
   "tags": [
    "important"
   ],
   "difficulty": 2,
   "ao": "AO1"
  },
  {
   "id": "b8-health-and-disease-fc14",
   "front": "Recall a key point about B8 Health And Disease",
   "back": "You need to interpret epidemiological data — this means reading graphs, tables and charts showing the incidence of diseases and their risk factors. Focus on: calculating percentage change in disease rates; reading data from bar charts and scatter graphs; identifying correlations in data.",
   "tags": [],
   "difficulty": 2,
   "ao": "AO1"
  },
  {
   "id": "b8-health-and-disease-fc15",
   "front": "What should you know about answers?",
   "back": "(a) This is a correlation — the data shows a statistical link but does not prove chocolate causes Nobel Prizes. (b) Confounding factor: wealthier countries can afford more chocolate AND have better education/research funding, which leads to more Nobel Prizes. The real driver is national wealth, not chocolate.",
   "tags": [
    "answers"
   ],
   "difficulty": 2,
   "ao": "AO1"
  }
 ]
}