{
 "subject": "english-literature",
 "board": "AQA",
 "topic": "M3-modern-novel-techniques",
 "topicName": "Modern Novel Techniques",
 "version": 1,
 "cards": [
  {
   "id": "m3-modern-novel-techniques-fc1",
   "front": "What should you know about why use unreliable narration??",
   "back": "• Creates suspense and mystery • Forces reader to question everything • Shows gap between perception and reality • Reveals character through what they hide",
   "tags": [
    "why-use-unreliable-narration"
   ],
   "difficulty": 2,
   "ao": "AO1"
  },
  {
   "id": "m3-modern-novel-techniques-fc2",
   "front": "What should you know about technique + quotation + effect = full marks?",
   "back": "When writing about novel techniques, never just name the method. Every paragraph must identify the technique, quote evidence, and explain the effect on the reader. For AO2, examiners reward analysis of how the writer manipulates narrative to shape meaning — not just what the story is about, but how it is told.",
   "tags": [
    "technique-quotation-effect-ful"
   ],
   "difficulty": 2,
   "ao": "AO1"
  },
  {
   "id": "m3-modern-novel-techniques-fc3",
   "front": "What does Organised, logical mean?",
   "back": "Chaotic, associative",
   "tags": [
    "table"
   ],
   "difficulty": 2,
   "ao": "AO1"
  },
  {
   "id": "m3-modern-novel-techniques-fc4",
   "front": "What does External events mean?",
   "back": "Internal thoughts",
   "tags": [
    "table"
   ],
   "difficulty": 2,
   "ao": "AO1"
  },
  {
   "id": "m3-modern-novel-techniques-fc5",
   "front": "What does Clear chronology mean?",
   "back": "Time shifts and loops",
   "tags": [
    "table"
   ],
   "difficulty": 2,
   "ao": "AO1"
  },
  {
   "id": "m3-modern-novel-techniques-fc6",
   "front": "What does Objective observer mean?",
   "back": "Subjective experience",
   "tags": [
    "table"
   ],
   "difficulty": 2,
   "ao": "AO1"
  },
  {
   "id": "m3-modern-novel-techniques-fc7",
   "front": "What does Innocent/naive mean?",
   "back": "Doesn't understand what they're describing (e.g. Child narrator)",
   "tags": [
    "table"
   ],
   "difficulty": 2,
   "ao": "AO1"
  },
  {
   "id": "m3-modern-novel-techniques-fc8",
   "front": "What does Deliberate liar mean?",
   "back": "Knowingly deceives reader (e.g. Villain narrating)",
   "tags": [
    "table"
   ],
   "difficulty": 2,
   "ao": "AO1"
  },
  {
   "id": "m3-modern-novel-techniques-fc9",
   "front": "What does Mentally unstable mean?",
   "back": "Distorted perception of reality (e.g. Madness, obsession)",
   "tags": [
    "table"
   ],
   "difficulty": 2,
   "ao": "AO1"
  },
  {
   "id": "m3-modern-novel-techniques-fc10",
   "front": "What does Self-deceived mean?",
   "back": "Lies to themselves as well as reader (e.g. Justifying bad actions)",
   "tags": [
    "table"
   ],
   "difficulty": 2,
   "ao": "AO1"
  },
  {
   "id": "m3-modern-novel-techniques-fc11",
   "front": "What does Alternating chapters mean?",
   "back": "Different characters narrate different sections (e.g. Compare viewpoints, see different sides)",
   "tags": [
    "table"
   ],
   "difficulty": 2,
   "ao": "AO1"
  },
  {
   "id": "m3-modern-novel-techniques-fc12",
   "front": "What does Interwoven voices mean?",
   "back": "Perspectives mix within scenes (e.g. Create tension, reveal contradictions)",
   "tags": [
    "table"
   ],
   "difficulty": 2,
   "ao": "AO1"
  },
  {
   "id": "m3-modern-novel-techniques-fc13",
   "front": "What does Letters/documents mean?",
   "back": "Story pieced together from multiple sources (e.g. Mystery, gradual revelation)",
   "tags": [
    "table"
   ],
   "difficulty": 2,
   "ao": "AO1"
  },
  {
   "id": "m3-modern-novel-techniques-fc14",
   "front": "What does Reflect trauma mean?",
   "back": "Memory and experience aren't neat or chronological",
   "tags": [
    "table"
   ],
   "difficulty": 2,
   "ao": "AO1"
  },
  {
   "id": "m3-modern-novel-techniques-fc15",
   "front": "What does Create mystery mean?",
   "back": "Reader must piece together what happened",
   "tags": [
    "table"
   ],
   "difficulty": 2,
   "ao": "AO1"
  }
 ]
}