{
 "subject": "citizenship-studies",
 "board": "AQA",
 "topic": "CI8-political-parties",
 "topicName": "Political Parties & Government",
 "version": 1,
 "cards": [
  {
   "id": "ci8-political-parties-fc1",
   "front": "Recall a key point about Political Parties & Government",
   "back": "Conservative Party: centre-right, supports free market capitalism, low taxes, private enterprise, traditional values, and strong defence. Traditionally supported by business owners, middle-class and older voters. Key policies: lower taxation, privatisation, strong law and order.",
   "tags": [
    "key-fact"
   ],
   "difficulty": 2,
   "ao": "AO1"
  },
  {
   "id": "ci8-political-parties-fc2",
   "front": "Recall a key point about Political Parties & Government",
   "back": "Labour Party: centre-left, supports social justice, public services, workers' rights, and redistribution of wealth through taxation. Traditionally supported by working-class voters, trade unions and ethnic minorities. Key policies: NHS investment, higher minimum wage, nationalisation of key services.",
   "tags": [
    "key-fact"
   ],
   "difficulty": 2,
   "ao": "AO1"
  },
  {
   "id": "ci8-political-parties-fc3",
   "front": "Recall a key point about Political Parties & Government",
   "back": "Other parties: Liberal Democrats (centre, proportional representation, civil liberties, EU membership), Green Party (environmentalism, social justice, renewable energy), Reform UK (right-wing populist, Eurosceptic, lower immigration, lower tax), Scottish National Party (Scottish independence, centre-left social democracy), Plaid Cymru (Welsh interests).",
   "tags": [
    "key-fact"
   ],
   "difficulty": 2,
   "ao": "AO1"
  },
  {
   "id": "ci8-political-parties-fc4",
   "front": "Recall a key point about Political Parties & Government",
   "back": "How government is formed: after a general election, the leader of the party with the most MPs usually becomes Prime Minister. If no party has a majority (hung parliament), parties negotiate to form a coalition (Conservative-Lib Dem 2010-2015) or a minority government with confidence-and-supply agreements. The PM appoints the Cabinet (about 20 senior ministers who run government departments).",
   "tags": [
    "key-fact"
   ],
   "difficulty": 2,
   "ao": "AO1"
  },
  {
   "id": "ci8-political-parties-fc5",
   "front": "Recall a key point about Political Parties & Government",
   "back": "The Prime Minister's powers: appoints and dismisses Cabinet ministers, chairs Cabinet, leads the governing party, represents the UK internationally, and can call early elections (with 2/3 Commons majority or via no-confidence vote). The PM is NOT directly elected by the public - they become PM by being leader of the largest party in the Commons.",
   "tags": [
    "key-fact"
   ],
   "difficulty": 2,
   "ao": "AO1"
  },
  {
   "id": "ci8-political-parties-fc6",
   "front": "What should you know about citizenship studies exam tips — political parties & government?",
   "back": "1. For Political Parties & Government questions, use citizenship terminology and reference democratic processes accurately 2. Consider multiple viewpoints — including those you disagree with 3. Link Political Parties & Government to current affairs and real-world examples where possible 4. When evaluating, consider both rights and responsibilities 5. Structure longer answers: identify the issue, analyse different perspectives, reach a justified view",
   "tags": [
    "citizenship-studies-exam-tips-"
   ],
   "difficulty": 2,
   "ao": "AO1"
  },
  {
   "id": "ci8-political-parties-fc7",
   "front": "Full-Mark Response",
   "back": "Evaluate whether the UK's system of forming a government is democratic.",
   "tags": [
    "section"
   ],
   "difficulty": 3,
   "ao": "AO1"
  },
  {
   "id": "ci8-political-parties-fc8",
   "front": "Assessment Objective Analysis",
   "back": "AO1 (Knowledge & Understanding — 30%): You need to demonstrate knowledge and understanding of political parties & government, including key concepts, legal frameworks, and institutional structures. AO2 (Analysis & Evaluation — 40%): You must analyse and evaluate different viewpoints, policies, and approaches related to political parties & government. Consider strengths and limitations, compare per",
   "tags": [
    "section"
   ],
   "difficulty": 3,
   "ao": "AO1"
  },
  {
   "id": "ci8-political-parties-fc9",
   "front": "Understanding Political Parties & Government in British Context",
   "back": "Political Parties & Government is a core topic in GCSE Citizenship Studies that requires understanding of how the UK political and legal systems work, and how citizens can participate effectively. The specification requires you to know how British democracy functions, understand your rights and responsibilities as a citizen, and be able to take informed and responsible action on citizenship issues",
   "tags": [
    "section"
   ],
   "difficulty": 3,
   "ao": "AO1"
  },
  {
   "id": "ci8-political-parties-fc10",
   "front": "Political Parties & Government and UK Democratic Processes",
   "back": "The UK is a parliamentary democracy where citizens exercise power through elected representatives. Understanding political parties & government requires knowledge of how democratic processes work: general elections (first past the post), devolved elections (additional member system for Scotland and Wales), local elections, and referendums. The UK does not have a written constitution — instead, con",
   "tags": [
    "section"
   ],
   "difficulty": 3,
   "ao": "AO1"
  },
  {
   "id": "ci8-political-parties-fc11",
   "front": "Rights, Responsibilities and Political Parties & Government",
   "back": "UK citizens have both rights and responsibilities. Key rights include: the right to vote, freedom of speech, freedom of religion, the right to a fair trial, and the right to privacy. These rights are protected by the Human Rights Act 1998, which incorporates the European Convention on Human Rights into UK law. The Supreme Court is the highest court in the UK and can declare government actions inco",
   "tags": [
    "section"
   ],
   "difficulty": 3,
   "ao": "AO1"
  },
  {
   "id": "ci8-political-parties-fc12",
   "front": "Ready to ace your GCSE Citizenship exams?",
   "back": "Get the best revision books and guides to boost your grades.",
   "tags": [
    "section"
   ],
   "difficulty": 3,
   "ao": "AO1"
  }
 ]
}