{
 "subject": "economics",
 "board": "AQA",
 "topic": "EC6-demand",
 "topicName": "Demand",
 "version": 1,
 "cards": [
  {
   "id": "ec6-demand-fc1",
   "front": "Recall a key point about Demand",
   "back": "Demand is the quantity consumers are willing and able to buy at a given price over a period of time.",
   "tags": [
    "key-fact"
   ],
   "difficulty": 2,
   "ao": "AO1"
  },
  {
   "id": "ec6-demand-fc2",
   "front": "Recall a key point about Demand",
   "back": "Law of demand: as price rises, quantity demanded falls (inverse relationship), shown by a downward-sloping demand curve.",
   "tags": [
    "key-fact"
   ],
   "difficulty": 2,
   "ao": "AO1"
  },
  {
   "id": "ec6-demand-fc3",
   "front": "Recall a key point about Demand",
   "back": "Factors shifting demand: income, tastes/fashion, price of substitutes and complements, population, advertising.",
   "tags": [
    "key-fact"
   ],
   "difficulty": 2,
   "ao": "AO1"
  },
  {
   "id": "ec6-demand-fc4",
   "front": "Recall a key point about Demand",
   "back": "Movement ALONG the curve = price change (affects quantity demanded). SHIFT of the curve = non-price factor change (changes demand at every price).",
   "tags": [
    "key-fact"
   ],
   "difficulty": 2,
   "ao": "AO1"
  },
  {
   "id": "ec6-demand-fc5",
   "front": "Recall a key point about Demand",
   "back": "Market demand = sum of all individual demand curves at each price level.",
   "tags": [
    "key-fact"
   ],
   "difficulty": 2,
   "ao": "AO1"
  },
  {
   "id": "ec6-demand-fc6",
   "front": "What should you know about economics exam tips?",
   "back": "When analysing demand changes, use the SIF framework: Shift or movement? Identify the factor. Follow through to equilibrium. Confusing shifts and movements is the most common exam error.",
   "tags": [
    "economics-exam-tips"
   ],
   "difficulty": 2,
   "ao": "AO1"
  },
  {
   "id": "ec6-demand-fc7",
   "front": "What does Cause mean?",
   "back": "Change in price of the good itself (e.g. Favourable change in non-price factor)",
   "tags": [
    "table"
   ],
   "difficulty": 2,
   "ao": "AO1"
  },
  {
   "id": "ec6-demand-fc8",
   "front": "What does What changes mean?",
   "back": "Quantity demanded (e.g. Demand at every price)",
   "tags": [
    "table"
   ],
   "difficulty": 2,
   "ao": "AO1"
  },
  {
   "id": "ec6-demand-fc9",
   "front": "What does Income effect mean?",
   "back": "Higher price = less real purchasing power (e.g. Higher income = more purchasing power)",
   "tags": [
    "table"
   ],
   "difficulty": 2,
   "ao": "AO1"
  },
  {
   "id": "ec6-demand-fc10",
   "front": "What does UK example mean?",
   "back": "Gas price rises, consumption falls (e.g. Rising wages increase restaurant demand)",
   "tags": [
    "table"
   ],
   "difficulty": 2,
   "ao": "AO1"
  },
  {
   "id": "ec6-demand-fc11",
   "front": "What does Diagram mean?",
   "back": "Slide along existing curve (e.g. Whole curve moves right)",
   "tags": [
    "table"
   ],
   "difficulty": 2,
   "ao": "AO1"
  },
  {
   "id": "ec6-demand-fc12",
   "front": "Watch Out!",
   "back": "Students often make mistakes here. Wrong: A rise in income always increases demand for all goods. Correct: A rise in income increases demand for NORMAL goods but DECREASES demand for INFERIOR goods (cheaper alternatives people buy less of as they get richer — e.g. own-brand products, bus travel). Always consider whether the good is normal or inferior.",
   "tags": [
    "section"
   ],
   "difficulty": 3,
   "ao": "AO1"
  },
  {
   "id": "ec6-demand-fc13",
   "front": "Full-Mark Response",
   "back": "Evaluate how a recession (falling incomes) would affect demand for supermarket own-brand products and luxury restaurant meals.",
   "tags": [
    "section"
   ],
   "difficulty": 3,
   "ao": "AO1"
  },
  {
   "id": "ec6-demand-fc14",
   "front": "Assessment Objective Focus: Demand",
   "back": "AO1 — Knowledge: Demonstrate knowledge of Demand with precise business/economic terminology. Define key terms and state accurate factual information.",
   "tags": [
    "section"
   ],
   "difficulty": 3,
   "ao": "AO1"
  },
  {
   "id": "ec6-demand-fc15",
   "front": "Understanding the Demand Curve and the Law of Demand",
   "back": "Demand is the quantity of a good or service that consumers are willing and able to buy at a given price over a period of time. The law of demand states that, ceteris paribus (all other things being equal), as the price of a good rises, the quantity demanded falls, and vice versa. This inverse relationship is shown by a downward-sloping demand curve on a diagram, with price on the vertical axis and",
   "tags": [
    "section"
   ],
   "difficulty": 3,
   "ao": "AO1"
  }
 ]
}