{
 "subject": "music",
 "board": "AQA",
 "topic": "MU8-romantic-music-1815-1910",
 "topicName": "Romantic Music 1815-1910",
 "version": 1,
 "cards": [
  {
   "id": "mu8-romantic-music-1815-1910-fc1",
   "front": "Recall a key point about Romantic Music 1815-1910",
   "back": "Romantic music prioritised emotional expression: chromatic harmony, rubato, wider dynamic range and thicker textures created intensity and drama.",
   "tags": [
    "key-fact"
   ],
   "difficulty": 2,
   "ao": "AO1"
  },
  {
   "id": "mu8-romantic-music-1815-1910-fc2",
   "front": "Recall a key point about Romantic Music 1815-1910",
   "back": "Chopin's piano music uses rubato (flexible tempo), elaborate ornamentation and harmonic chromaticism — it demands expressive, personal interpretation.",
   "tags": [
    "key-fact"
   ],
   "difficulty": 2,
   "ao": "AO1"
  },
  {
   "id": "mu8-romantic-music-1815-1910-fc3",
   "front": "Recall a key point about Romantic Music 1815-1910",
   "back": "The Romantic orchestra expanded significantly: more brass (trombones, tuba), more woodwind (piccolo, cor anglais, bass clarinet), harp and percussion.",
   "tags": [
    "key-fact"
   ],
   "difficulty": 2,
   "ao": "AO1"
  },
  {
   "id": "mu8-romantic-music-1815-1910-fc4",
   "front": "Recall a key point about Romantic Music 1815-1910",
   "back": "Late Romantic Requiems (Verdi, Fauré) combined liturgical text with dramatic orchestration — sacred music with theatrical emotional power.",
   "tags": [
    "key-fact"
   ],
   "difficulty": 2,
   "ao": "AO1"
  },
  {
   "id": "mu8-romantic-music-1815-1910-fc5",
   "front": "What should you know about music exam tips?",
   "back": "Identify Romantic features: chromatic harmony, rubato, expanded orchestration, programmatic elements. Compare with Classical style. Explain how features reflect Romantic values.",
   "tags": [
    "music-exam-tips"
   ],
   "difficulty": 2,
   "ao": "AO1"
  },
  {
   "id": "mu8-romantic-music-1815-1910-fc6",
   "front": "Watch Out!",
   "back": "Students often make mistakes here. Wrong: Romantic music is just classical music that is more emotional. Correct: Romantic music has SPECIFIC identifiable features: chromatic harmony (moving beyond diatonic chords), expanded orchestration, programmatic elements (music telling stories), rubato, thicker polyphonic textures, and nationalism. These are distinguishable features the exam tests you on.",
   "tags": [
    "section"
   ],
   "difficulty": 3,
   "ao": "AO1"
  },
  {
   "id": "mu8-romantic-music-1815-1910-fc7",
   "front": "Full-Mark Response",
   "back": "Compare a Romantic piano piece by Chopin with a Classical piano piece by Mozart. Identify at least three differences in musical elements and explain how each reflects the change from Classical to Romantic style.",
   "tags": [
    "section"
   ],
   "difficulty": 3,
   "ao": "AO1"
  },
  {
   "id": "mu8-romantic-music-1815-1910-fc8",
   "front": "Assessment Objective Focus: Romantic Music 1815-1910",
   "back": "AO1 — Knowledge: Show knowledge of Romantic Music 1815-1910 using appropriate musical vocabulary (e.g. terminology for elements, devices, and contexts).",
   "tags": [
    "section"
   ],
   "difficulty": 3,
   "ao": "AO1"
  },
  {
   "id": "mu8-romantic-music-1815-1910-fc9",
   "front": "Understanding Romantic Music 1815-1910",
   "back": "Romantic Music 1815-1910 is a key element of GCSE Music requiring theoretical understanding and practical application. The AQA specification requires you to identify, describe and analyse this element in set works and unfamiliar music. Focus on the specific AQA terminology — examiners reward precise vocabulary over vague descriptions. Understanding how romantic music 1815-1910 contributes to the o",
   "tags": [
    "section"
   ],
   "difficulty": 3,
   "ao": "AO1"
  },
  {
   "id": "mu8-romantic-music-1815-1910-fc10",
   "front": "Applying Romantic Music 1815-1910 in Performance and Composition",
   "back": "Understanding romantic music 1815-1910 informs your performing (AO1) and composing (AO2) work. In performance, awareness of romantic music 1815-1910 helps you make interpretive decisions that serve the music. In composition, romantic music 1815-1910 provides the building blocks of your creative work — the choices you make about this element shape the identity and coherence of your piece.",
   "tags": [
    "section"
   ],
   "difficulty": 3,
   "ao": "AO1"
  },
  {
   "id": "mu8-romantic-music-1815-1910-fc11",
   "front": "Exam Technique for Romantic Music 1815-1910 Questions",
   "back": "In the AQA GCSE Music listening exam, questions about romantic music 1815-1910 typically ask you to: identify features by ear; describe how they are used; explain their effect; compare features between extracts. The key to success is precise terminology — never use vague language.",
   "tags": [
    "section"
   ],
   "difficulty": 3,
   "ao": "AO1"
  },
  {
   "id": "mu8-romantic-music-1815-1910-fc12",
   "front": "Ready to ace your GCSE Music exams?",
   "back": "Get the best revision books and guides to boost your grades.",
   "tags": [
    "section"
   ],
   "difficulty": 3,
   "ao": "AO1"
  }
 ]
}