{
 "subject": "pe",
 "board": "AQA",
 "topic": "PE38-diet-nutrition",
 "topicName": "Diet and Nutrition",
 "version": 1,
 "cards": [
  {
   "id": "pe38-diet-nutrition-fc1",
   "front": "What should you know about energy balance?",
   "back": "The relationship between the calories consumed through food and drink (energy in) and the calories expended through basal metabolic rate and physical activity (energy out). Maintaining energy balance is essential for managing body weight.",
   "tags": [
    "energy-balance"
   ],
   "difficulty": 2,
   "ao": "AO1"
  },
  {
   "id": "pe38-diet-nutrition-fc2",
   "front": "What should you know about for athletes?",
   "back": "Performers must carefully manage energy balance to maintain optimal body composition for their sport. Endurance athletes need high calorie intake to fuel training, while athletes in weight-category sports must balance energy to make their weight class.",
   "tags": [
    "for-athletes"
   ],
   "difficulty": 2,
   "ao": "AO1"
  },
  {
   "id": "pe38-diet-nutrition-fc3",
   "front": "What should you know about carbohydrates?",
   "back": "The body's primary and most efficient source of energy, particularly for high-intensity exercise. Carbohydrates are broken down into glucose, which is stored as glycogen in the muscles and liver.",
   "tags": [
    "carbohydrates"
   ],
   "difficulty": 2,
   "ao": "AO1"
  },
  {
   "id": "pe38-diet-nutrition-fc4",
   "front": "What should you know about fats?",
   "back": "A concentrated source of energy that provides more than double the calories per gram compared to carbohydrates or protein. Fats are essential for insulation, protection of organs, and as a long-term energy source during low-intensity exercise.",
   "tags": [
    "fats"
   ],
   "difficulty": 2,
   "ao": "AO1"
  },
  {
   "id": "pe38-diet-nutrition-fc5",
   "front": "What should you know about protein?",
   "back": "A macronutrient made up of amino acids that is essential for muscle repair, growth and recovery after exercise. Protein also plays a role in enzyme production, immune function and hormone synthesis.",
   "tags": [
    "protein"
   ],
   "difficulty": 2,
   "ao": "AO1"
  },
  {
   "id": "pe38-diet-nutrition-fc6",
   "front": "What should you know about vitamins?",
   "back": "Organic micronutrients required in small amounts for various metabolic processes. They cannot be synthesised by the body in sufficient quantities and must be obtained from the diet.",
   "tags": [
    "vitamins"
   ],
   "difficulty": 2,
   "ao": "AO1"
  },
  {
   "id": "pe38-diet-nutrition-fc7",
   "front": "What should you know about minerals?",
   "back": "Inorganic micronutrients essential for various body functions including bone health, oxygen transport and muscle contraction. Like vitamins, they must be obtained from the diet.",
   "tags": [
    "minerals"
   ],
   "difficulty": 2,
   "ao": "AO1"
  },
  {
   "id": "pe38-diet-nutrition-fc8",
   "front": "What should you know about iron for athletes?",
   "back": "Iron is particularly important for endurance athletes because it is the core component of haemoglobin, which carries oxygen in red blood cells. Iron deficiency anaemia reduces the blood's oxygen-carrying capacity, directly impairing aerobic performance. Female athletes are at higher risk due to menstrual blood loss.",
   "tags": [
    "iron-for-athletes"
   ],
   "difficulty": 2,
   "ao": "AO1"
  },
  {
   "id": "pe38-diet-nutrition-fc9",
   "front": "What should you know about dietary fibre?",
   "back": "The indigestible part of plant foods that passes through the digestive system relatively intact. Fibre is essential for healthy digestion and preventing digestive disorders.",
   "tags": [
    "dietary-fibre"
   ],
   "difficulty": 2,
   "ao": "AO1"
  },
  {
   "id": "pe38-diet-nutrition-fc10",
   "front": "What should you know about caution for athletes?",
   "back": "High-fibre foods should be avoided immediately before competition as they can cause bloating, gas and stomach discomfort during exercise. Athletes should consume fibre-rich foods in their regular diet but reduce intake in the 24-48 hours before competition.",
   "tags": [
    "caution-for-athletes"
   ],
   "difficulty": 2,
   "ao": "AO1"
  },
  {
   "id": "pe38-diet-nutrition-fc11",
   "front": "What should you know about pe exam tips — diet and nutrition?",
   "back": "1. For Diet and Nutrition questions, use subject-specific terminology precisely 2. Support every point with specific evidence or examples 3. Show balanced analysis — consider different perspectives before reaching a conclusion 4. Link your understanding of Diet and Nutrition to real-world contexts where possible 5. For longer answers, plan your response to address all parts of the question",
   "tags": [
    "pe-exam-tips-diet-and-nutritio"
   ],
   "difficulty": 2,
   "ao": "AO1"
  },
  {
   "id": "pe38-diet-nutrition-fc12",
   "front": "What does Vitamin A mean?",
   "back": "Supports immune function and vision (e.g. Carrots, liver, sweet potato, spinach)",
   "tags": [
    "table"
   ],
   "difficulty": 2,
   "ao": "AO1"
  },
  {
   "id": "pe38-diet-nutrition-fc13",
   "front": "What does Vitamin B complex mean?",
   "back": "Energy release from carbohydrates; red blood cell production (e.g. Whole grains, meat, eggs, dairy)",
   "tags": [
    "table"
   ],
   "difficulty": 2,
   "ao": "AO1"
  },
  {
   "id": "pe38-diet-nutrition-fc14",
   "front": "What does Vitamin C mean?",
   "back": "Immune function; collagen production for healthy tendons and ligaments; antioxidant (e.g. Citrus fruits, peppers, berries, broccoli)",
   "tags": [
    "table"
   ],
   "difficulty": 2,
   "ao": "AO1"
  },
  {
   "id": "pe38-diet-nutrition-fc15",
   "front": "What does Vitamin D mean?",
   "back": "Calcium absorption for bone health; immune function (e.g. Sunlight, oily fish, eggs, fortified foods)",
   "tags": [
    "table"
   ],
   "difficulty": 2,
   "ao": "AO1"
  }
 ]
}