{
 "subject": "business",
 "board": "AQA",
 "topic": "BS12-quality",
 "topicName": "Quality",
 "version": 1,
 "cards": [
  {
   "id": "bs12-quality-fc1",
   "front": "Recall a key point about Quality",
   "back": "Quality control (QC) inspects the finished product to detect defects - it's reactive and occurs after production. Defective items are rejected or reworked.",
   "tags": [
    "key-fact"
   ],
   "difficulty": 2,
   "ao": "AO1"
  },
  {
   "id": "bs12-quality-fc2",
   "front": "Recall a key point about Quality",
   "back": "Quality assurance (QA) builds quality into every stage of the production process - it's proactive and aims to prevent defects before they occur.",
   "tags": [
    "key-fact"
   ],
   "difficulty": 2,
   "ao": "AO1"
  },
  {
   "id": "bs12-quality-fc3",
   "front": "Recall a key point about Quality",
   "back": "Total quality management (TQM) involves every employee in continuous quality improvement: zero defects culture, employee empowerment, and customer focus throughout the organisation.",
   "tags": [
    "key-fact"
   ],
   "difficulty": 2,
   "ao": "AO1"
  },
  {
   "id": "bs12-quality-fc4",
   "front": "Recall a key point about Quality",
   "back": "ISO 9001 is an international quality standard: businesses must document processes, demonstrate consistent quality, and pass regular audits. Certification builds customer trust.",
   "tags": [
    "key-fact"
   ],
   "difficulty": 2,
   "ao": "AO1"
  },
  {
   "id": "bs12-quality-fc5",
   "front": "Recall a key point about Quality",
   "back": "Higher quality reduces costs long-term: fewer returns, less rework, better reputation, more repeat business, and ability to charge premium prices.",
   "tags": [
    "key-fact"
   ],
   "difficulty": 2,
   "ao": "AO1"
  },
  {
   "id": "bs12-quality-fc6",
   "front": "What should you know about business exam tips?",
   "back": "When evaluating quality systems, use the PAC framework: Prevention (how does it stop defects?), Assurance (how does it build customer confidence?), Cost (do the benefits outweigh the investment?). Quality always has a cost, but poor quality costs more.",
   "tags": [
    "business-exam-tips"
   ],
   "difficulty": 2,
   "ao": "AO1"
  },
  {
   "id": "bs12-quality-fc7",
   "front": "Watch Out!",
   "back": "Students often make mistakes here. Wrong: High-quality products always cost more to produce than low-quality products. Correct: While high-quality materials may cost more, quality systems often REDUCE total costs by eliminating: rework (fixing defects), returns and refunds, warranty claims, lost customers, and wasted materials. A business with effective QA may have lower total costs than one using",
   "tags": [
    "section"
   ],
   "difficulty": 3,
   "ao": "AO1"
  },
  {
   "id": "bs12-quality-fc8",
   "front": "Full-Mark Response",
   "back": "Evaluate whether a food manufacturer should move from quality control to quality assurance.",
   "tags": [
    "section"
   ],
   "difficulty": 3,
   "ao": "AO1"
  },
  {
   "id": "bs12-quality-fc9",
   "front": "Assessment Objective Focus: Quality",
   "back": "AO1 — Knowledge: Demonstrate knowledge of Quality with precise business/economic terminology. Define key terms and state accurate factual information.",
   "tags": [
    "section"
   ],
   "difficulty": 3,
   "ao": "AO1"
  },
  {
   "id": "bs12-quality-fc10",
   "front": "Understanding Quality in Business Context",
   "back": "Quality is a key topic in GCSE Business Studies that affects how businesses operate in the UK economy. Understanding this concept requires knowledge of both theoretical principles and real-world application. The AQA specification requires you to explain, analyse and evaluate business concepts using appropriate terminology, and apply them to real business scenarios using UK examples.",
   "tags": [
    "section"
   ],
   "difficulty": 3,
   "ao": "AO1"
  },
  {
   "id": "bs12-quality-fc11",
   "front": "Applying Quality to UK Business Examples",
   "back": "For quality, applying theory to practice means using real UK business examples to illustrate your understanding. Small businesses face different challenges from large corporations when dealing with quality. Consider how factors like business size, ownership structure, industry sector and market position affect the impact of quality on a business.",
   "tags": [
    "section"
   ],
   "difficulty": 3,
   "ao": "AO1"
  },
  {
   "id": "bs12-quality-fc12",
   "front": "Exam Technique for Quality Questions",
   "back": "GCSE Business exam questions about quality range from 1-mark definition questions to 12-mark evaluation questions. For definition questions (1-2 marks), give a precise business definition. For explanation questions (3-4 marks), define and explain with a brief example. For analysis questions (6-9 marks), develop a chain of reasoning showing cause and effect. For evaluation questions (12 marks), pre",
   "tags": [
    "section"
   ],
   "difficulty": 3,
   "ao": "AO1"
  },
  {
   "id": "bs12-quality-fc13",
   "front": "Ready to ace your GCSE Business exams?",
   "back": "Get the best revision books and guides to boost your grades.",
   "tags": [
    "section"
   ],
   "difficulty": 3,
   "ao": "AO1"
  }
 ]
}