{
 "subject": "combined-science",
 "board": "AQA",
 "topic": "C11-gas-calculations",
 "topicName": "Gas Calculations",
 "version": 1,
 "cards": [
  {
   "id": "c11-gas-calculations-fc1",
   "front": "What should you know about molar gas volume?",
   "back": "The volume occupied by one mole of any gas at room temperature and pressure (RTP). At RTP (20°C and 1 atm), one mole of any gas occupies 24 dm³ (or 24 000 cm³).",
   "tags": [
    "molar-gas-volume"
   ],
   "difficulty": 2,
   "ao": "AO1"
  },
  {
   "id": "c11-gas-calculations-fc2",
   "front": "What should you know about room temperature and pressure (rtp)?",
   "back": "20°C and 1 atmosphere pressure. At RTP, equal amounts in moles of any gas occupy the same volume.",
   "tags": [
    "room-temperature-and-pressure-"
   ],
   "difficulty": 2,
   "ao": "AO1"
  },
  {
   "id": "c11-gas-calculations-fc3",
   "front": "Mathematical Skills",
   "back": "Molar gas volume: At RTP, 1 mole of any gas occupies 24 dm³. Volume (dm³) = moles × 24. Moles = volume (dm³) ÷ 24.",
   "tags": [
    "section"
   ],
   "difficulty": 3,
   "ao": "AO1"
  },
  {
   "id": "c11-gas-calculations-fc4",
   "front": "Watch Out!",
   "back": "Gas volume at RTP depends on the type of gas. Wrong: gas volume depends on gas type at RTP Correct: at RTP, 1 mole of ANY gas occupies 24 dm³ — the particles are far apart so particle size does not matter",
   "tags": [
    "section"
   ],
   "difficulty": 3,
   "ao": "AO1"
  },
  {
   "id": "c11-gas-calculations-fc5",
   "front": "Extended Answer",
   "back": "6 marks: Explain how to calculate gas volumes in reactions.",
   "tags": [
    "section"
   ],
   "difficulty": 3,
   "ao": "AO1"
  },
  {
   "id": "c11-gas-calculations-fc6",
   "front": "Analysis and Evaluation",
   "back": "A student burns 0.8 g of methane (CH₄, M r = 16) and collects the CO₂ gas produced. Equation: CH₄ + 2O₂ → CO₂ + 2H₂O(l). The student measures 1.0 dm³ of CO₂.",
   "tags": [
    "section"
   ],
   "difficulty": 3,
   "ao": "AO1"
  },
  {
   "id": "c11-gas-calculations-fc7",
   "front": "Ready to ace your GCSE Combined Science exams?",
   "back": "Get the best revision books and guides to boost your grades.",
   "tags": [
    "section"
   ],
   "difficulty": 3,
   "ao": "AO1"
  }
 ]
}