{
 "subject": "religious-studies",
 "board": "AQA",
 "topic": "RS28-human-sexuality-and-relationships",
 "topicName": "Human Sexuality and Relationships",
 "version": 1,
 "cards": [
  {
   "id": "rs28-human-sexuality-and-relationships-fc1",
   "front": "Recall a key point about Human Sexuality and Relationships",
   "back": "GCSE RS requires you to understand Christian and Muslim teachings about sexuality, including heterosexual and same-sex relationships, and sex before and outside of marriage.",
   "tags": [
    "key-fact"
   ],
   "difficulty": 2,
   "ao": "AO1"
  },
  {
   "id": "rs28-human-sexuality-and-relationships-fc2",
   "front": "What should you know about rs exam tips — human sexuality and relationships?",
   "back": "1. For Human Sexuality and Relationships questions, always include specific scriptural or source references where relevant 2. Explain both religious and non-religious viewpoints 3. Use specialist vocabulary precisely (e.g. terms from the specification) 4. Evaluate by analysing strengths and weaknesses of different views before reaching your conclusion 5. Link your discussion of Human Sexuality and Relationships to its real-world impact on believers and society",
   "tags": [
    "rs-exam-tips-human-sexuality-a"
   ],
   "difficulty": 2,
   "ao": "AO1"
  },
  {
   "id": "rs28-human-sexuality-and-relationships-fc3",
   "front": "What should you know about uk context?",
   "back": "In the UK, debates about often involve both religious and secular voices. Parliament considers evidence from faith communities alongside scientific, legal and ethical perspectives, reflecting Britain’s commitment to both religious freedom and democratic decision-making.",
   "tags": [
    "uk-context"
   ],
   "difficulty": 2,
   "ao": "AO1"
  },
  {
   "id": "rs28-human-sexuality-and-relationships-fc4",
   "front": "What should you know about uk context?",
   "back": "The British system of establishing laws through parliamentary debate, judicial interpretation and public consultation allows religious perspectives to be heard alongside other viewpoints. Faith communities regularly submit evidence to parliamentary committees and participate in public consultations on issues related to .",
   "tags": [
    "uk-context"
   ],
   "difficulty": 2,
   "ao": "AO1"
  },
  {
   "id": "rs28-human-sexuality-and-relationships-fc5",
   "front": "What should you know about uk context?",
   "back": "British examiners specifically look for the use of specific scriptural references (e.g. Surah numbers, Bible chapter and verse) and named scholars or traditions. Vague references to ‘what Christians believe’ or ‘what Muslims think’ without specific evidence will not achieve the highest marks.",
   "tags": [
    "uk-context"
   ],
   "difficulty": 2,
   "ao": "AO1"
  },
  {
   "id": "rs28-human-sexuality-and-relationships-fc6",
   "front": "Watch Out!",
   "back": "Students often oversimplify religious views on relationships. Wrong: \"All Christians oppose same-sex relationships.\" Correct: \"While the Catholic Church teaches homosexual acts are wrong, many Protestant denominations (e.g. Quakers, United Reformed Church) accept and bless same-sex relationships. Views vary within and between traditions.\"",
   "tags": [
    "section"
   ],
   "difficulty": 3,
   "ao": "AO1"
  },
  {
   "id": "rs28-human-sexuality-and-relationships-fc7",
   "front": "Full-Mark Response",
   "back": "12 marks: Evaluate the view that heterosexual and same-sex relationships; sexual relationships before and outside of marriage.",
   "tags": [
    "section"
   ],
   "difficulty": 3,
   "ao": "AO1"
  },
  {
   "id": "rs28-human-sexuality-and-relationships-fc8",
   "front": "Assessment Objective Focus: Human Sexuality and Relationships",
   "back": "AO1 — Knowledge: Show precise knowledge of Human Sexuality and Relationships, using specialist vocabulary and referring to sources of wisdom and authority (e.g. scripture, sacred texts).",
   "tags": [
    "section"
   ],
   "difficulty": 3,
   "ao": "AO1"
  },
  {
   "id": "rs28-human-sexuality-and-relationships-fc9",
   "front": "Ready to ace your GCSE Religious Studies exams?",
   "back": "Get the best revision books and guides to boost your grades.",
   "tags": [
    "section"
   ],
   "difficulty": 3,
   "ao": "AO1"
  }
 ]
}