{
 "subject": "psychology",
 "board": "AQA",
 "topic": "PS9-crowd-and-collective-behaviour",
 "topicName": "Crowd & Collective Behaviour",
 "version": 1,
 "cards": [
  {
   "id": "ps9-crowd-and-collective-behaviour-fc1",
   "front": "Recall a key point about Crowd & Collective Behaviour",
   "back": "Deindividuation: losing your sense of personal identity in a crowd, which can lead to behaviour you would not normally do. Anonymity (e.g. uniforms, masks) reduces self-awareness and increases conformity to group norms.",
   "tags": [
    "key-fact"
   ],
   "difficulty": 2,
   "ao": "AO1"
  },
  {
   "id": "ps9-crowd-and-collective-behaviour-fc2",
   "front": "Recall a key point about Crowd & Collective Behaviour",
   "back": "Social Identity Theory (Tajfel & Turner): we derive part of our identity from group membership. Process: social categorisation -> social identification -> social comparison. This can lead to in-group favouritism and out-group discrimination.",
   "tags": [
    "key-fact"
   ],
   "difficulty": 2,
   "ao": "AO1"
  },
  {
   "id": "ps9-crowd-and-collective-behaviour-fc3",
   "front": "Recall a key point about Crowd & Collective Behaviour",
   "back": "Tajfel's minimal group paradigm: even when groups are assigned arbitrarily (e.g. preference for Klee vs Kandinsky), participants favoured their in-group. This shows that even meaningless group distinctions create bias.",
   "tags": [
    "key-fact"
   ],
   "difficulty": 2,
   "ao": "AO1"
  },
  {
   "id": "ps9-crowd-and-collective-behaviour-fc4",
   "front": "Recall a key point about Crowd & Collective Behaviour",
   "back": "Prejudice: a negative attitude towards a group based on stereotypes. Discrimination: unfair treatment based on group membership. Causes: social identity, scapegoating, media representations, and authoritarian personality.",
   "tags": [
    "key-fact"
   ],
   "difficulty": 2,
   "ao": "AO1"
  },
  {
   "id": "ps9-crowd-and-collective-behaviour-fc5",
   "front": "Recall a key point about Crowd & Collective Behaviour",
   "back": "Reducing prejudice: intergroup contact (Allport's contact hypothesis), superordinate goals (Sherif's Robbers Cave experiment), and education about stereotyping.",
   "tags": [
    "key-fact"
   ],
   "difficulty": 2,
   "ao": "AO1"
  },
  {
   "id": "ps9-crowd-and-collective-behaviour-fc6",
   "front": "What should you know about psychology exam tips?",
   "back": "When evaluating crowd behaviour and prejudice, consider: lab vs real-world, cultural factors, and practical applications (how can findings reduce discrimination in schools and workplaces?).",
   "tags": [
    "psychology-exam-tips"
   ],
   "difficulty": 2,
   "ao": "AO1"
  },
  {
   "id": "ps9-crowd-and-collective-behaviour-fc7",
   "front": "Watch Out!",
   "back": "Students often make mistakes here. Wrong: Crowds always make people behave more aggressively than they would alone. Correct: Deindividuation theory shows that crowds lead people to follow group norms - which can be aggressive or prosocial. Johnson & Downing (1979) found that participants in KKK-style uniforms gave more shocks (antisocial norm), but those in nurses' uniforms gave fewer shocks (pros",
   "tags": [
    "section"
   ],
   "difficulty": 3,
   "ao": "AO1"
  },
  {
   "id": "ps9-crowd-and-collective-behaviour-fc8",
   "front": "Full-Mark Response",
   "back": "Evaluate the view that prejudice is an inevitable consequence of group membership.",
   "tags": [
    "section"
   ],
   "difficulty": 3,
   "ao": "AO1"
  },
  {
   "id": "ps9-crowd-and-collective-behaviour-fc9",
   "front": "Assessment Objective Focus: Crowd & Collective Behaviour",
   "back": "AO1 — Knowledge: Demonstrate knowledge of Crowd & Collective Behaviour including key definitions, research studies and psychological terminology.",
   "tags": [
    "section"
   ],
   "difficulty": 3,
   "ao": "AO1"
  },
  {
   "id": "ps9-crowd-and-collective-behaviour-fc10",
   "front": "Key Studies and Theories in Crowd & Collective Behaviour",
   "back": "Crowd & Collective Behaviour is a core topic in GCSE Psychology that requires understanding of key studies, theories and research methods. The AQA, OCR and Edexcel specifications all require you to know specific studies in detail, evaluate their methodology, and apply psychological concepts to real-life scenarios. When studying crowd & collective behaviour, focus on: the aims, methods, results and",
   "tags": [
    "section"
   ],
   "difficulty": 3,
   "ao": "AO1"
  },
  {
   "id": "ps9-crowd-and-collective-behaviour-fc11",
   "front": "Evaluating Research in Crowd & Collective Behaviour",
   "back": "Evaluation is a crucial skill in GCSE Psychology. When evaluating studies related to crowd & collective behaviour, use the GRAVE method: Generalisability (can the findings be applied to the wider population?), Reliability (are the results consistent if the study is repeated?), Applications (how can the findings be used in real life?), Validity (does the study measure what it claims to measure?), a",
   "tags": [
    "section"
   ],
   "difficulty": 3,
   "ao": "AO1"
  },
  {
   "id": "ps9-crowd-and-collective-behaviour-fc12",
   "front": "Applying Crowd & Collective Behaviour to Real Life",
   "back": "GCSE Psychology requires you to apply psychological understanding of crowd & collective behaviour to everyday situations. Consider how the theories and studies you have learned about explain real behaviour: How does crowd & collective behaviour affect people in schools, workplaces, families and communities? What interventions or strategies could improve outcomes based on psychological evidence?",
   "tags": [
    "section"
   ],
   "difficulty": 3,
   "ao": "AO1"
  },
  {
   "id": "ps9-crowd-and-collective-behaviour-fc13",
   "front": "Ready to ace your GCSE Psychology exams?",
   "back": "Get the best revision books and guides to boost your grades.",
   "tags": [
    "section"
   ],
   "difficulty": 3,
   "ao": "AO1"
  }
 ]
}